{
  "$schema": "https://json-schema.org/draft/2020-12/schema",
  "title": "Observation",
  "description": "Measurements and simple assertions made about a patient, device or other subject.",
  "x-source": "https://api.medplum.com/openapi.json",
  "properties": {
    "resourceType": {
      "description": "This is a Observation resource",
      "type": "string"
    },
    "id": {
      "description": "The logical id of the resource, as used in the URL for the resource. Once assigned, this value never changes.",
      "$ref": "#/components/schemas/id"
    },
    "meta": {
      "description": "The metadata about the resource. This is content that is maintained by the infrastructure. Changes to the content might not always be associated with version changes to the resource.",
      "$ref": "#/components/schemas/Meta"
    },
    "implicitRules": {
      "description": "A reference to a set of rules that were followed when the resource was constructed, and which must be understood when processing the content. Often, this is a reference to an implementation guide that defines the special rules along with other profiles etc.",
      "$ref": "#/components/schemas/uri"
    },
    "language": {
      "description": "The base language in which the resource is written.",
      "$ref": "#/components/schemas/code"
    },
    "text": {
      "description": "A human-readable narrative that contains a summary of the resource and can be used to represent the content of the resource to a human. The narrative need not encode all the structured data, but is required to contain sufficient detail to make it \"clinically safe\" for a human to just read the narrative. Resource definitions may define what content should be represented in the narrative to ensure clinical safety.",
      "$ref": "#/components/schemas/Narrative"
    },
    "contained": {
      "description": "These resources do not have an independent existence apart from the resource that contains them - they cannot be identified independently, and nor can they have their own independent transaction scope.",
      "items": {
        "$ref": "#/components/schemas/ResourceList"
      },
      "type": "array"
    },
    "extension": {
      "description": "May be used to represent additional information that is not part of the basic definition of the resource. To make the use of extensions safe and manageable, there is a strict set of governance  applied to the definition and use of extensions. Though any implementer can define an extension, there is a set of requirements that SHALL be met as part of the definition of the extension.",
      "items": {
        "$ref": "#/components/schemas/Extension"
      },
      "type": "array"
    },
    "modifierExtension": {
      "description": "May be used to represent additional information that is not part of the basic definition of the resource and that modifies the understanding of the element that contains it and/or the understanding of the containing element's descendants. Usually modifier elements provide negation or qualification. To make the use of extensions safe and manageable, there is a strict set of governance applied to the definition and use of extensions. Though any implementer is allowed to define an extension, there is a set of requirements that SHALL be met as part of the definition of the extension. Applications processing a resource are required to check for modifier extensions.\n\nModifier extensions SHALL NOT change the meaning of any elements on Resource or DomainResource (including cannot change the meaning of modifierExtension itself).",
      "items": {
        "$ref": "#/components/schemas/Extension"
      },
      "type": "array"
    },
    "identifier": {
      "description": "A unique identifier assigned to this observation.",
      "items": {
        "$ref": "#/components/schemas/Identifier"
      },
      "type": "array"
    },
    "basedOn": {
      "description": "A plan, proposal or order that is fulfilled in whole or in part by this event.  For example, a MedicationRequest may require a patient to have laboratory test performed before  it is dispensed.",
      "items": {
        "$ref": "#/components/schemas/Reference"
      },
      "type": "array"
    },
    "partOf": {
      "description": "A larger event of which this particular Observation is a component or step.  For example,  an observation as part of a procedure.",
      "items": {
        "$ref": "#/components/schemas/Reference"
      },
      "type": "array"
    },
    "status": {
      "description": "The status of the result value.",
      "enum": [
        "registered",
        "preliminary",
        "final",
        "amended",
        "corrected",
        "cancelled",
        "entered-in-error",
        "unknown"
      ]
    },
    "category": {
      "description": "A code that classifies the general type of observation being made.",
      "items": {
        "$ref": "#/components/schemas/CodeableConcept"
      },
      "type": "array"
    },
    "code": {
      "description": "Describes what was observed. Sometimes this is called the observation \"name\".",
      "$ref": "#/components/schemas/CodeableConcept"
    },
    "subject": {
      "description": "The patient, or group of patients, location, or device this observation is about and into whose record the observation is placed. If the actual focus of the observation is different from the subject (or a sample of, part, or region of the subject), the `focus` element or the `code` itself specifies the actual focus of the observation.",
      "$ref": "#/components/schemas/Reference"
    },
    "focus": {
      "description": "The actual focus of an observation when it is not the patient of record representing something or someone associated with the patient such as a spouse, parent, fetus, or donor. For example, fetus observations in a mother's record.  The focus of an observation could also be an existing condition,  an intervention, the subject's diet,  another observation of the subject,  or a body structure such as tumor or implanted device.   An example use case would be using the Observation resource to capture whether the mother is trained to change her child's tracheostomy tube. In this example, the child is the patient of record and the mother is the focus.",
      "items": {
        "$ref": "#/components/schemas/Reference"
      },
      "type": "array"
    },
    "encounter": {
      "description": "The healthcare event  (e.g. a patient and healthcare provider interaction) during which this observation is made.",
      "$ref": "#/components/schemas/Reference"
    },
    "effectiveDateTime": {
      "description": "The time or time-period the observed value is asserted as being true. For biological subjects - e.g. human patients - this is usually called the \"physiologically relevant time\". This is usually either the time of the procedure or of specimen collection, but very often the source of the date/time is not known, only the date/time itself.",
      "pattern": "^([0-9]([0-9]([0-9][1-9]|[1-9]0)|[1-9]00)|[1-9]000)(-(0[1-9]|1[0-2])(-(0[1-9]|[1-2][0-9]|3[0-1])(T([01][0-9]|2[0-3]):[0-5][0-9]:([0-5][0-9]|60)(\\.[0-9]+)?(Z|(\\+|-)((0[0-9]|1[0-3]):[0-5][0-9]|14:00)))?)?)?$",
      "type": "string"
    },
    "effectivePeriod": {
      "description": "The time or time-period the observed value is asserted as being true. For biological subjects - e.g. human patients - this is usually called the \"physiologically relevant time\". This is usually either the time of the procedure or of specimen collection, but very often the source of the date/time is not known, only the date/time itself.",
      "$ref": "#/components/schemas/Period"
    },
    "effectiveTiming": {
      "description": "The time or time-period the observed value is asserted as being true. For biological subjects - e.g. human patients - this is usually called the \"physiologically relevant time\". This is usually either the time of the procedure or of specimen collection, but very often the source of the date/time is not known, only the date/time itself.",
      "$ref": "#/components/schemas/Timing"
    },
    "effectiveInstant": {
      "description": "The time or time-period the observed value is asserted as being true. For biological subjects - e.g. human patients - this is usually called the \"physiologically relevant time\". This is usually either the time of the procedure or of specimen collection, but very often the source of the date/time is not known, only the date/time itself.",
      "pattern": "^([0-9]([0-9]([0-9][1-9]|[1-9]0)|[1-9]00)|[1-9]000)-(0[1-9]|1[0-2])-(0[1-9]|[1-2][0-9]|3[0-1])T([01][0-9]|2[0-3]):[0-5][0-9]:([0-5][0-9]|60)(\\.[0-9]+)?(Z|(\\+|-)((0[0-9]|1[0-3]):[0-5][0-9]|14:00))$",
      "type": "string"
    },
    "issued": {
      "description": "The date and time this version of the observation was made available to providers, typically after the results have been reviewed and verified.",
      "$ref": "#/components/schemas/instant"
    },
    "performer": {
      "description": "Who was responsible for asserting the observed value as \"true\".",
      "items": {
        "$ref": "#/components/schemas/Reference"
      },
      "type": "array"
    },
    "valueQuantity": {
      "description": "The information determined as a result of making the observation, if the information has a simple value.",
      "$ref": "#/components/schemas/Quantity"
    },
    "valueCodeableConcept": {
      "description": "The information determined as a result of making the observation, if the information has a simple value.",
      "$ref": "#/components/schemas/CodeableConcept"
    },
    "valueString": {
      "description": "The information determined as a result of making the observation, if the information has a simple value.",
      "pattern": "^[ \\r\\n\\t\\S]+$",
      "type": "string"
    },
    "valueBoolean": {
      "description": "The information determined as a result of making the observation, if the information has a simple value.",
      "pattern": "^true|false$",
      "type": "boolean"
    },
    "valueInteger": {
      "description": "The information determined as a result of making the observation, if the information has a simple value.",
      "pattern": "^-?([0]|([1-9][0-9]*))$",
      "type": "number"
    },
    "valueRange": {
      "description": "The information determined as a result of making the observation, if the information has a simple value.",
      "$ref": "#/components/schemas/Range"
    },
    "valueRatio": {
      "description": "The information determined as a result of making the observation, if the information has a simple value.",
      "$ref": "#/components/schemas/Ratio"
    },
    "valueSampledData": {
      "description": "The information determined as a result of making the observation, if the information has a simple value.",
      "$ref": "#/components/schemas/SampledData"
    },
    "valueTime": {
      "description": "The information determined as a result of making the observation, if the information has a simple value.",
      "pattern": "^([01][0-9]|2[0-3]):[0-5][0-9]:([0-5][0-9]|60)(\\.[0-9]+)?$",
      "type": "string"
    },
    "valueDateTime": {
      "description": "The information determined as a result of making the observation, if the information has a simple value.",
      "pattern": "^([0-9]([0-9]([0-9][1-9]|[1-9]0)|[1-9]00)|[1-9]000)(-(0[1-9]|1[0-2])(-(0[1-9]|[1-2][0-9]|3[0-1])(T([01][0-9]|2[0-3]):[0-5][0-9]:([0-5][0-9]|60)(\\.[0-9]+)?(Z|(\\+|-)((0[0-9]|1[0-3]):[0-5][0-9]|14:00)))?)?)?$",
      "type": "string"
    },
    "valuePeriod": {
      "description": "The information determined as a result of making the observation, if the information has a simple value.",
      "$ref": "#/components/schemas/Period"
    },
    "dataAbsentReason": {
      "description": "Provides a reason why the expected value in the element Observation.value[x] is missing.",
      "$ref": "#/components/schemas/CodeableConcept"
    },
    "interpretation": {
      "description": "A categorical assessment of an observation value.  For example, high, low, normal.",
      "items": {
        "$ref": "#/components/schemas/CodeableConcept"
      },
      "type": "array"
    },
    "note": {
      "description": "Comments about the observation or the results.",
      "items": {
        "$ref": "#/components/schemas/Annotation"
      },
      "type": "array"
    },
    "bodySite": {
      "description": "Indicates the site on the subject's body where the observation was made (i.e. the target site).",
      "$ref": "#/components/schemas/CodeableConcept"
    },
    "method": {
      "description": "Indicates the mechanism used to perform the observation.",
      "$ref": "#/components/schemas/CodeableConcept"
    },
    "specimen": {
      "description": "The specimen that was used when this observation was made.",
      "$ref": "#/components/schemas/Reference"
    },
    "device": {
      "description": "The device used to generate the observation data.",
      "$ref": "#/components/schemas/Reference"
    },
    "referenceRange": {
      "description": "Guidance on how to interpret the value by comparison to a normal or recommended range.  Multiple reference ranges are interpreted as an \"OR\".   In other words, to represent two distinct target populations, two `referenceRange` elements would be used.",
      "items": {
        "$ref": "#/components/schemas/Observation_ReferenceRange"
      },
      "type": "array"
    },
    "hasMember": {
      "description": "This observation is a group observation (e.g. a battery, a panel of tests, a set of vital sign measurements) that includes the target as a member of the group.",
      "items": {
        "$ref": "#/components/schemas/Reference"
      },
      "type": "array"
    },
    "derivedFrom": {
      "description": "The target resource that represents a measurement from which this observation value is derived. For example, a calculated anion gap or a fetal measurement based on an ultrasound image.",
      "items": {
        "$ref": "#/components/schemas/Reference"
      },
      "type": "array"
    },
    "component": {
      "description": "Some observations have multiple component observations.  These component observations are expressed as separate code value pairs that share the same attributes.  Examples include systolic and diastolic component observations for blood pressure measurement and multiple component observations for genetics observations.",
      "items": {
        "$ref": "#/components/schemas/Observation_Component"
      },
      "type": "array"
    }
  },
  "additionalProperties": false,
  "required": [
    "code",
    "resourceType"
  ]
}