{
  "resourceType": "Observation",
  "status": "final",
  "category": [
    {
      "coding": [
        {
          "system": "http://terminology.hl7.org/CodeSystem/observation-category",
          "code": "vital-signs",
          "display": "Vital Signs"
        }
      ]
    }
  ],
  "code": {
    "coding": [
      {
        "system": "http://loinc.org",
        "code": "85354-9",
        "display": "Blood pressure panel"
      }
    ]
  },
  "subject": { "reference": "Patient/example" },
  "effectiveDateTime": "2026-05-25T09:15:00Z",
  "component": [
    {
      "code": {
        "coding": [
          { "system": "http://loinc.org", "code": "8480-6", "display": "Systolic blood pressure" }
        ]
      },
      "valueQuantity": { "value": 120, "unit": "mmHg", "system": "http://unitsofmeasure.org", "code": "mm[Hg]" }
    },
    {
      "code": {
        "coding": [
          { "system": "http://loinc.org", "code": "8462-4", "display": "Diastolic blood pressure" }
        ]
      },
      "valueQuantity": { "value": 78, "unit": "mmHg", "system": "http://unitsofmeasure.org", "code": "mm[Hg]" }
    }
  ]
}
